{
  "$schema": "./schemas/dependency-map.schema.json",
  "version": "1.0.0",
  "generated": "2026-09-11T05:25:00Z",
  "description": "Network topology of all 15 HFT platform services. Edges represent runtime dependencies (caller -> callee). Finalized 2026-09-11 (Phase 2, item 4): every upstream/downstream array is re-derived from edges[] (see direction-convention note) and cross-checked against the client code on disk.",
  "services": [
    {
      "id": "S1",
      "name": "market-data-gateway",
      "dir": "services/market-data-gateway",
      "language": "python",
      "package": "mdg",
      "port": 7610,
      "status": "complete",
      "description": "Ingests raw venue feeds (ITCH/FIX/MDP3), normalizes to canonical wire format, maintains sequence tracking and quality metrics, distributes quotes to downstream consumers.",
      "upstream": [],
      "downstream": ["S2", "S3", "S8"],
      "endpoints": [
        "GET /healthz",
        "GET /readyz",
        "POST /subscribe",
        "GET /quotes/{symbol}",
        "GET /books/{symbol}/{venue}",
        "GET /venues",
        "GET /quality"
      ]
    },
    {
      "id": "S2",
      "name": "order-book-builder",
      "dir": "services/order-book-builder",
      "language": "python",
      "package": "obb",
      "port": 7620,
      "status": "complete",
      "description": "Maintains L2 limit order books per (symbol, venue) from normalized quotes. Computes top-of-book, detects material changes (spread moves, imbalance, depth drain), emits book events to subscribers.",
      "upstream": ["S1"],
      "downstream": ["S3", "S5", "S6", "S8"],
      "endpoints": [
        "GET /healthz",
        "GET /readyz",
        "GET /books/{symbol}/{venue}",
        "GET /books",
        "GET /top-of-book/{symbol}/{venue}",
        "POST /subscribe-events",
        "POST /rebuild/{symbol}/{venue}"
      ]
    },
    {
      "id": "S3",
      "name": "strategy-engine",
      "dir": "services/strategy-engine",
      "language": "python",
      "package": "ste",
      "port": 7630,
      "status": "complete",
      "description": "Consumes book events and quotes to generate trading signals (entry/exit). Runs pluggable strategy modules (momentum, mean-reversion, spread arbitrage). Emits order intents to the execution gateway.",
      "upstream": ["S1", "S2", "S4"],
      "downstream": [],
      "endpoints": [
        "GET /healthz",
        "GET /readyz",
        "GET /signals",
        "GET /signals/{symbol}",
        "POST /strategies",
        "DELETE /strategies/{id}",
        "GET /strategies",
        "POST /pause",
        "POST /resume"
      ]
    },
    {
      "id": "S4",
      "name": "execution-gateway",
      "dir": "services/execution-gateway",
      "language": "rust",
      "package": null,
      "port": 7640,
      "status": "complete",
      "description": "Translates order intents from the strategy engine into venue-specific order messages (FIX/ITCH). Manages order lifecycle (new, modify, cancel, replace), tracks acknowledgments, and reports fill events back. Makes no outbound calls of its own: order intents are pushed to it (POST /orders) and consumers poll it (GET /fills) — see the S13 design-intent note.",
      "upstream": [],
      "downstream": ["S3", "S5", "S6"],
      "endpoints": [
        "GET /healthz",
        "GET /readyz",
        "POST /orders",
        "PATCH /orders/{id}",
        "DELETE /orders/{id}",
        "GET /orders",
        "GET /orders/{id}",
        "GET /fills"
      ]
    },
    {
      "id": "S5",
      "name": "risk-manager",
      "dir": "services/risk-manager",
      "language": "python",
      "package": "rkm",
      "port": 7650,
      "status": "complete",
      "description": "Pre-trade and real-time risk checks. Enforces position limits, notional caps, velocity limits, kill-switch triggers. Veto power over the execution gateway (can reject or flatten).",
      "upstream": ["S2", "S4", "S10", "S13"],
      "downstream": [],
      "endpoints": [
        "GET /healthz",
        "GET /readyz",
        "POST /pre-trade-check",
        "GET /limits",
        "PUT /limits",
        "GET /exposure",
        "POST /kill-switch",
        "POST /kill-switch/disengage",
        "GET /kill-switch",
        "GET /breaches",
        "DELETE /limits",
        "GET /stats"
      ]
    },
    {
      "id": "S6",
      "name": "position-keeper",
      "dir": "services/position-keeper",
      "language": "python",
      "package": "posk",
      "port": 7660,
      "status": "complete",
      "description": "Maintains authoritative real-time position state per (account, symbol). Applies fills, corporate actions, and manual adjustments. Provides position snapshots for analytics and settlement.",
      "upstream": ["S4", "S2"],
      "downstream": ["S9", "S14"],
      "endpoints": [
        "GET /healthz",
        "GET /readyz",
        "GET /positions",
        "GET /positions/{symbol}",
        "GET /positions/snapshot",
        "POST /adjust",
        "POST /corporate-action",
        "GET /history/{symbol}",
        "GET /stats"
      ]
    },
    {
      "id": "S7",
      "name": "latency-monitor",
      "dir": "services/latency-monitor",
      "language": "rust",
      "package": null,
      "port": 7670,
      "status": "complete",
      "description": "Measures and reports end-to-end latency across the pipeline: venue-to-gateway, gateway-to-book, book-to-signal, signal-to-order, order-to-ack. Maintains rolling percentiles (p50/p99/p999) and fires alerts on budget breaches. Pure push-based service: it exposes POST /stamp (pipeline stages POST the timestamp pair or a pre-computed duration) and keeps an in-memory, per-stage, budget-bounded alert history; it makes no outbound calls itself (no upstream edges).",
      "upstream": [],
      "downstream": [],
      "endpoints": [
        "GET /healthz",
        "GET /readyz",
        "POST /stamp",
        "GET /latency",
        "GET /latency/{stage}",
        "GET /percentiles",
        "GET /budgets"
      ]
    },
    {
      "id": "S8",
      "name": "data-quality-monitor",
      "dir": "services/data-quality-monitor",
      "language": "python",
      "package": "dqm",
      "port": 7680,
      "status": "complete",
      "description": "Aggregates quality metrics from S1 (staleness, gaps, ordering violations) and S2 (book health, cross events). Produces a unified data-quality dashboard view and triggers degradation alerts.",
      "upstream": ["S1", "S2", "S10"],
      "downstream": [],
      "endpoints": [
        "GET /healthz",
        "GET /readyz",
        "GET /quality-summary",
        "GET /quality/{symbol}",
        "GET /gaps",
        "GET /staleness",
        "GET /degradations"
      ]
    },
    {
      "id": "S9",
      "name": "portfolio-analytics",
      "dir": "services/portfolio-analytics",
      "language": "python",
      "package": "pfa",
      "port": 7690,
      "status": "complete",
      "description": "Computes P&L (realized/unrealized), Sharpe ratio, drawdown, VaR, and attribution analytics from positions + fills. Serves historical and real-time portfolio metrics to the API gateway.",
      "upstream": ["S6"],
      "downstream": ["S15"],
      "endpoints": [
        "GET /healthz",
        "GET /readyz",
        "GET /pnl",
        "GET /pnl/{symbol}",
        "GET /metrics",
        "GET /attribution",
        "GET /var",
        "GET /history"
      ]
    },
    {
      "id": "S10",
      "name": "alerting-service",
      "dir": "services/alerting-service",
      "language": "rust",
      "package": null,
      "port": 7700,
      "status": "complete",
      "description": "Central alert aggregation, deduplication/suppression, escalation and acknowledgement tracking. Receives alerts from risk-manager (S5), latency-monitor (S7) and data-quality-monitor (S8); collapses repeated occurrences into logical alerts, escalates un-acknowledged WARNINGs to CRITICAL and flags aged CRITICALs for on-call.",
      "upstream": [],
      "downstream": ["S5", "S8", "S11"],
      "endpoints": [
        "GET /healthz",
        "GET /readyz",
        "POST /alerts",
        "GET /alerts",
        "GET /alerts/{id}",
        "POST /alerts/ack",
        "POST /alerts/{id}/resolve",
        "GET /alerts/dispatch",
        "GET /stats"
      ]
    },
    {
      "id": "S11",
      "name": "config-service",
      "dir": "services/config-service",
      "language": "python",
      "package": "cfgs",
      "port": 7710,
      "status": "complete",
      "description": "Centralized configuration store and distribution. Serves versioned config blobs to all services at boot and on change (long-poll). Manages environment overrides and feature flags. Ships AlertingClient (S10) and AuditClient (S13) for best-effort fan-out; no service on disk issues a config-service client call, so it has no caller edges — see the design-intent note.",
      "upstream": ["S10", "S13"],
      "downstream": [],
      "endpoints": [
        "GET /healthz",
        "GET /readyz",
        "GET /config/{service}",
        "PUT /config/{service}",
        "GET /configs",
        "POST /reload",
        "GET /versions",
        "GET /changes",
        "GET /changes/watch",
        "POST /overrides",
        "DELETE /overrides",
        "GET /overrides",
        "GET /flags",
        "PUT /flags/{name}",
        "GET /stats"
      ]
    },
    {
      "id": "S12",
      "name": "auth-service",
      "dir": "services/auth-service",
      "language": "rust",
      "package": null,
      "port": 7720,
      "status": "complete",
      "last_verified": "2026-09-10",
      "description": "Authentication and authorization. Issues and validates JWT tokens for inter-service and external API calls. Manages service-to-service mTLS certificates and API key rotation.",
      "upstream": [],
      "downstream": ["S15"],
      "endpoints": [
        "GET /healthz",
        "GET /readyz",
        "POST /token",